### ISSUE TITLE
Dokploy stack routing issue when using internal only deployments

### ISSUE THREAD

**Issue by TheLinuxGuy** [Dokploy/dokploy#1698]
### To Reproduce

1. Create LXC container or VM with ubuntu/debian image.
2. Install dokploy, first set the environment variable matching the LXC container IP (we don't want WAN IP for swarm): 
`export ADVERTISE_ADDR=192.168.10.84`
3. Run install `curl -sSL https://dokploy.com/install.sh | sh`
4. Wait for success message in terminal which says to visit http://192.168.10.84:3000
5. Attempt to access 192.168.10.84:3000 from a local internal IP (mine 192.168.10.x). It will fail

### Current vs. Expected behavior

Current behavior http://192.168.10.84:3000 does not work post install, user cannot complete setup. Clients from internal IPs (192.168.x.x) do not seem to be able to view the dokploy setup page that's expected.

Further debugging shows the network packet from my personal computer reach the VM/LXC container hosting dokploy but once the packet goes thru the docker network it gets sent to `172.18.0.5.3000` but apparently no docker container is running on that IP.

```bash
root@dokploy2:~# tcpdump -A -i any port 3000 -nn
tcpdump: data link type LINUX_SLL2
tcpdump: verbose output suppressed, use -v[v]... for full protocol decode
listening on any, link-type LINUX_SLL2 (Linux cooked v2), snapshot length 262144 bytes
07:32:25.130159 eth0  In  IP 192.168.10.175.53314 > 192.168.10.84.3000: Flags [S], seq 3363965685, win 65535, options [mss 1460,nop,wscale 6,nop,nop,TS val 418939138 ecr 0,sackOK,eol], length 0
E..@..@.@..d..
...
T.B....
.........W;.............
............
07:32:25.130192 docker_gwbridge Out IP 192.168.10.175.53314 > 172.18.0.5.3000: Flags [S], seq 3363965685, win 65535, options [mss 1460,nop,wscale 6,nop,nop,TS val 418939138 ecr 0,sackOK,eol], length 0
E..@..@.?..I..
......B....
.........v .............
............
07:32:25.130195 vethd72123d Out IP 192.168.10.175.53314 > 172.18.0.5.3000: Flags [S], seq 3363965685, win 65535, options [mss 1460,nop,wscale 6,nop,nop,TS val 418939138 ecr 0,sackOK,eol], length 0
E..@..@.?..I..
......B....
.........v .............
............
07:32:25.130213 vethd72123d P   IP 172.18.0.5.3000 > 192.168.10.175.53314: Flags [R.], seq 0, ack 3363965686, win 0, length 0
E..(..@.@..a......
....B......
.P.......
07:32:25.130213 docker_gwbridge In  IP 172.18.0.5.3000 > 192.168.10.175.53314: Flags [R.], seq 0, ack 1, win 0, length 0
E..(..@.@..a......
....B......
.P.......
07:32:25.130226 eth0  Out IP 192.168.10.84.3000 > 192.168.10.175.53314: Flags [R.], seq 0, ack 3363965686, win 0, length 0
E..(..@.?..|..
T..
....B......
.P...j  ..
^C
6 packets captured
6 packets received by filter
0 packets dropped by kernel
root@dokploy2:~# docker ps -q | xargs docker inspect --format '{{.Name}} - {{range .NetworkSettings.Networks}}{{.IPAddress}}{{end}}'
/dokploy-traefik - 10.0.1.9
/dokploy.1.cy8ir6q9d9nubrxtf2qb6vqhs - 10.0.1.8
/dokploy-redis.1.hswk2y7ufzxxzmmxtsjw4ocrq - 10.0.1.6
/dokploy-postgres.1.yo338juwad7o3pjft1yiz0trt - 10.0.1.3
root@dokploy2:~# 
```

This bug has been reproduced twice, back to back, when I tried to install or deploy dokploy in my homelab... I was only able to test and use dokploy if I deployed using Azure with a Public IPv4.

Please fix this bug so dokploy can be used on internal networks.

### Provide environment information

```bash
Version v0.21.6

root@dokploy2:~# cat /etc/os-release; uname -a  
PRETTY_NAME="Debian GNU/Linux 12 (bookworm)"
NAME="Debian GNU/Linux"
VERSION_ID="12"
VERSION="12 (bookworm)"
VERSION_CODENAME=bookworm
ID=debian
HOME_URL="https://www.debian.org/"
SUPPORT_URL="https://www.debian.org/support"
BUG_REPORT_URL="https://bugs.debian.org/"

Linux dokploy2 6.8.12-9-pve #1 SMP PREEMPT_DYNAMIC PMX 6.8.12-9 (2025-03-16T19:18Z)
```

### Which area(s) are affected? (Select all that apply)

Installation

### Are you deploying the applications where Dokploy is installed or on a remote server?

Same server where Dokploy is installed

### Will you send a PR to fix it?

No

**Comment by Siumauricio** [comment]
No response I assume the answer is clear.
